{
  "schema_version": "1.0",
  "rows": [
    {
      "id": "civic-polling-card",
      "theme": "A polling card that tells one voter where to vote, when, and what to bring.",
      "domain": "civic",
      "why_it_works_at_L4": "One sheet, three facts and a deadline: small enough to finish properly, large enough that every hierarchy decision is visible.",
      "screen_count_estimate": 4,
      "pitfalls": [
        "Becomes a leaflet explaining how voting works rather than a card about this person's station",
        "The station address loses the top of the page to a crest and a council logo",
        "Students invent the ID rules; the task is presenting rules, not writing them"
      ],
      "too_big_variant": "An electoral services site covering registration, postal votes and results.",
      "not_an_app": true,
      "example_screen_ids": null
    },
    {
      "id": "civic-planning-consultation-form",
      "theme": "A response form for a local planning notice, for someone who has never read one.",
      "domain": "civic",
      "why_it_works_at_L4": "The content is genuinely hard and genuinely public, so every layout choice has to be argued rather than styled.",
      "screen_count_estimate": 6,
      "pitfalls": [
        "Turns into a petition — a form offering only 'object' has stopped being a consultation",
        "Free-text boxes with no prompt return blank; writing the prompt is the design work",
        "Legal wording is pasted in whole instead of paired with a plain summary"
      ],
      "too_big_variant": "The council's whole planning portal, with maps, case histories and officer reports.",
      "not_an_app": true,
      "example_screen_ids": null
    },
    {
      "id": "civic-jury-summons",
      "theme": "A jury summons letter a person can act on without ringing to ask what it means.",
      "domain": "civic",
      "why_it_works_at_L4": "One high-stakes document where tone, hierarchy and the reply deadline compete openly, which is what a beginner needs to see.",
      "screen_count_estimate": 5,
      "pitfalls": [
        "The date you must reply by ends up smaller than the crest above it",
        "Threatening tone is treated as fixed rather than as something the designer chose",
        "The envelope gets redesigned and the letter inside never does"
      ],
      "too_big_variant": "Every letter a courts service sends, redesigned as one correspondence system.",
      "not_an_app": true,
      "example_screen_ids": null
    },
    {
      "id": "civic-council-tax-bill",
      "theme": "A council tax bill showing what was charged, why, and what to do if it is wrong.",
      "domain": "civic",
      "why_it_works_at_L4": "Numbers a student did not choose, in a hierarchy they must choose, with a dispute route that is usually buried.",
      "screen_count_estimate": 5,
      "pitfalls": [
        "The total is set large and the payment date is not",
        "The breakdown table is styled before it is decided what the reader is comparing",
        "'How to query this' is left as a phone number in the footer"
      ],
      "too_big_variant": "A billing account area covering direct debits, arrears and every year's history.",
      "not_an_app": true,
      "example_screen_ids": null
    },
    {
      "id": "civic-station-exit-signs",
      "theme": "A set of signs taking a pedestrian from one station exit to three civic buildings.",
      "domain": "civic",
      "why_it_works_at_L4": "Position, scale and reading distance stop being abstract the moment the reader is walking past at speed.",
      "screen_count_estimate": 6,
      "pitfalls": [
        "Designed at desk distance and never checked at four metres",
        "All three destinations given equal weight, so the sign decides nothing",
        "Arrows added last, as decoration, rather than as the grammar of the set"
      ],
      "too_big_variant": "A wayfinding system for the whole city centre.",
      "not_an_app": true,
      "example_screen_ids": null
    },
    {
      "id": "civic-noise-report",
      "theme": "Reporting a noise problem to a council, from first screen to a reference number.",
      "domain": "civic",
      "why_it_works_at_L4": "A short flow with a real emotional temperature, and an ending — the reference number — that most student flows forget to design.",
      "screen_count_estimate": 6,
      "pitfalls": [
        "The confirmation screen says 'thank you' and not what happens next or when",
        "Asks for the address before asking what the problem is",
        "Becomes a complaints dashboard for council staff instead of the resident's flow"
      ],
      "too_big_variant": "A whole environmental health case management system.",
      "not_an_app": true,
      "example_screen_ids": null
    },
    {
      "id": "civic-bin-day-lookup",
      "theme": "Finding out which bin goes out this week at one address.",
      "domain": "civic",
      "why_it_works_at_L4": "A single question with a single answer, so the portfolio has to be about clarity rather than about features.",
      "screen_count_estimate": 4,
      "pitfalls": [
        "The answer arrives as a twelve-month calendar instead of 'the green one, tomorrow'",
        "Colour alone carries which bin, which fails the moment it is printed",
        "A postcode field with no memory, so the same address is typed every week"
      ],
      "too_big_variant": "A waste services site with bulky collections, recycling guides and permits.",
      "not_an_app": false,
      "example_screen_ids": null
    },
    {
      "id": "civic-allotment-waiting-list",
      "theme": "Checking your position on a council allotment waiting list, and what it means.",
      "domain": "civic",
      "why_it_works_at_L4": "A number with no action attached to it — the design problem is making a long wait feel handled rather than ignored.",
      "screen_count_estimate": 4,
      "pitfalls": [
        "Shows a position and no sense of movement, which reads as a dead page",
        "An estimated date is invented to fill the space, which the council could not honour",
        "Turns into a plot-booking system nobody on the list can use yet"
      ],
      "too_big_variant": null,
      "not_an_app": false,
      "example_screen_ids": null
    },
    {
      "id": "health-repeat-prescription",
      "theme": "Ordering one repeat prescription and knowing when it can be collected.",
      "domain": "health",
      "why_it_works_at_L4": "Small, repeated, and consequential: the same task done monthly exposes every friction a one-off flow hides.",
      "screen_count_estimate": 5,
      "pitfalls": [
        "Medicine names are set in one weight, so the reader cannot tell dose from brand",
        "'Ordered' and 'ready to collect' are shown as the same state",
        "Students design for a first-time user of a task people do forty times"
      ],
      "too_big_variant": "A full patient record area with results, referrals and appointments.",
      "not_an_app": false,
      "example_screen_ids": null
    },
    {
      "id": "health-appointment-letter",
      "theme": "An appointment letter that survives being stuck to a fridge for three weeks.",
      "domain": "health",
      "why_it_works_at_L4": "The artefact has a known life — pinned up, glanced at, carried in — and that life should drive the layout.",
      "screen_count_estimate": 4,
      "pitfalls": [
        "Date, time and place are separated by two paragraphs of preamble",
        "What to bring is written as prose rather than as a list you can check against",
        "The cancellation number is set in the same size as the hospital's address"
      ],
      "too_big_variant": "An appointments system covering booking, rescheduling and reminders.",
      "not_an_app": true,
      "example_screen_ids": null
    },
    {
      "id": "health-medicine-box-label",
      "theme": "The dispensing label on a box of tablets, for a reader holding three other boxes.",
      "domain": "health",
      "why_it_works_at_L4": "A severe space constraint with a real cost of error, which forces genuine decisions about what is dropped.",
      "screen_count_estimate": 4,
      "pitfalls": [
        "The patient's name is given more room than the dose",
        "Warnings are stacked so uniformly that none of them reads as a warning",
        "Designed as one label, never as three sitting side by side on a table"
      ],
      "too_big_variant": null,
      "not_an_app": true,
      "example_screen_ids": null
    },
    {
      "id": "health-clinic-checkin-kiosk",
      "theme": "Checking in for a clinic appointment at a kiosk in a busy waiting room.",
      "domain": "health",
      "why_it_works_at_L4": "Standing, watched by a queue, one finger, no help nearby — constraints a student can feel without any research budget.",
      "screen_count_estimate": 6,
      "pitfalls": [
        "Date of birth entry designed for a mouse and a keyboard",
        "Confirmation flashes and clears before the person has looked up",
        "Text height set for a phone in the hand, not a screen at arm's length"
      ],
      "too_big_variant": "A patient administration system covering arrivals, triage and room allocation.",
      "not_an_app": true,
      "example_screen_ids": null
    },
    {
      "id": "health-symptom-diary",
      "theme": "Keeping a two-week symptom diary to take to one appointment.",
      "domain": "health",
      "why_it_works_at_L4": "Entry is daily and dull; the payoff is a single summary — a clean argument about designing for the boring middle.",
      "screen_count_estimate": 6,
      "pitfalls": [
        "Entry takes two minutes a day, so it is abandoned on day four",
        "A ten-point severity scale nobody can use consistently",
        "The summary the clinician actually reads is never designed at all"
      ],
      "too_big_variant": "A general health tracker covering sleep, mood, exercise and medication.",